Link,Title,Content
https://www.straitstimes.com/singapore/environment/more-must-be-done-to-help-singaporeans-make-sustainable-choices-ocbc-climate-index,More must be done to help S'poreans make sustainable choices: OCBC climate index,"SINGAPORE - Sustainability has become a buzzword in Singapore, but has not caused consumers to alter their habits to promote it, according to the findings of a local environmental index. While most Singaporean consumers say they are environmentally conscious, they tend to make purchases based on cost, convenience and preference, found the climate index released on Tuesday (Aug 16) by OCBC Bank and Eco-Business, a media and business intelligence firm. Sustainability is seen as a bonus or a happy consequence of a purchasing choice that made sense in the first place, the index also found. The index, which was first launched last year, hopes to raise awareness about environmental issues, nudge people towards more sustainable behaviour and influence policymakers. This year, after surveying 2,169 Singaporeans between the ages of 18 and 65, the index came up at a national average of 6.7 out of 10. The respondents were evaluated on their level of awareness regarding environmental issues, how many sustainable practices they have adopted, and how much they advocated for sustainable change. Based on the index, OCBC said that while most Singaporeans are conscious of almost all environmental issues, they make few sustainable choices on average and advocate for sustainability even more selectively. Also, Singaporeans scored exactly the same as last year, with little progress despite more investment in environmental awareness, said Mr Jason Boh, vice-president of Market Research at OCBC Bank. Some environmentally harmful choices were traced to the increased use of air conditioning, the resumption of travel as the Covid-19 pandemic abates, and consumerism as the economy recovers. Additionally, Gen-Z citizens chose to eat unsustainably owing to difficulty in changing their diets and a belief that their choices made little environmental difference. They also spent more on non-essential products. However, there are some encouraging findings, said Mr Boh. Those aged between 58 and 65 advocated for more climate action this year due to their increased comfort with digital tools acquired during the pandemic. Also, with more in that age group retiring, their lifestyles slow down and become more environmentally friendly, such as them choosing to take public transport more often. Additionally, citizens between the ages of 18 and 25 are also redirecting their finances into buying second-hand products, which are increasingly seen as legitimate, cheap and clean. Ms Jessica Cheam, founder and managing director of Eco-Business, said: ""Mainstreaming sustainability-driven consumer behaviour takes time, and many factors such as cost, convenience and infrastructure heavily impact personal decisions."" While some of the results can be discouraging, Ms Cheam said that the index ultimately aims to provide insight into the factors behind consumer decisions and what needs to be done to create a better environment for the right choices. Ms Cheam added that through a better understanding of people's behaviour, society can change for the better and never again return to old, unsustainable habits."
https://www.straitstimes.com/singapore/environment/green-pulse-podcast-how-to-truly-value-nature,How to truly value nature,"Synopsis: Every first and third Monday of the month, The Straits Times analyses the beat of the changing environment, from biodiversity conservation to climate change. If you look at a stretch of rainforest, how do you measure its true value? Is it for the timber in the trees, the medicines in the roots and bark, the water stored in its soils or for its ability to absorb carbon dioxide? A local villager might value it more for its cultural or spiritual worth or for the animals that provide food. A palm oil plantation developer might value the land the forest stands on. Scientists tell us that nature provides benefits to people worth trillions of dollars a year, from the air we breathe to the soils we grow our food in. But it really depends on your perspective. And that’s the challenge in trying to put a value on nature. The more humanity destroys nature, the greater the threat to our existence.  Recently, the United Nations’ science advisory panel for biodiversity, known as IPBES, looked at this complex issue and found there are dozens of ways to measure the value of nature. The report came up with guidelines for policymakers. It found that putting a narrow economic value on nature is one of the key reasons behind the loss and damage to the world’s ecosystems.  In this episode, The Straits Times’ environment correspondent Audrey Tan and climate change editor David Fogarty discuss nature valuation with Dr Michael Christie, Professor of Environmental and Ecological Economics at Aberystwyth University in Wales, who is one of the co-chairs of the report.  Highlights (click/tap above): 1:33 Examples of nature's value 4:46 Why is it important to consider different ways to value nature? 7:20 Main recommendations of the IPBES report 12:24 How to manage conflicts over developments such as building a wind farm that might harm local wildlife? 15:13 Best ways for city-dwellers to connect with nature Produced by: Audrey Tan (audreyt@sph.com.sg), David Fogarty (dfogarty@sph.com.sg), Ernest Luis and Hadyu Rahim Edited by: Hadyu Rahim Subscribe to Green Pulse Podcast series and rate us on your favourite audio apps: Channel: https://str.sg/JWaf Apple Podcasts: https://str.sg/JWaY Spotify: https://str.sg/JWag Google Podcasts: https://str.sg/J6EV  Website: http://str.sg/stpodcasts Feedback to: podcast@sph.com.sg Follow Audrey Tan on Twitter: https://str.sg/JLMB Read her stories: https://str.sg/JLM2 Follow David Fogarty on Twitter: https://str.sg/JLM6 Read his stories: https://str.sg/JLMu --- Discover ST's special edition podcasts: Singapore's War On Covid: https://str.sg/wuJa The Unsolved Mysteries of South-east Asia: https://str.sg/wuZ2 Stop Scams: https://str.sg/wuZB Invisible Asia: https://str.sg/wuZn --- Discover more ST podcast series: Asian Insider: https://str.sg/JWa7 Health Check: https://str.sg/JWaN In Your Opinion: https://str.sg/w7Qt Your Money & Career: https://str.sg/wB2m SG Extra: https://str.sg/wukR #PopVultures: https://str.sg/JWad ST Sports Talk: https://str.sg/JWRE Bookmark This!: https://str.sg/JWas Lunch With Sumiko: https://str.sg/J6hQ Discover ST Podcasts: http://str.sg/stpodcasts Discover BT Podcasts: https://bt.sg/pcPL Follow our shows then, if you like short, practical podcasts! #greenpulse"
https://www.straitstimes.com/singapore/environment/effort-to-digitise-spores-natural-history-key-to-fostering-conservation-national-pride,"Effort to digitise S'pore's natural history key to fostering conservation, national pride","SINGAPORE - The truth of the matter is that you cannot conserve what you do not know, said National University of Singapore (NUS) Professor Peter Ng. But in order to gain that knowledge, he added, you need to return to conservation's source of knowledge - the past. And in the case of the project that Prof Ng is leading at Lee Kong Chian Natural History Museum in NUS, the pursuit of this past stretches more than 200 years."
https://www.straitstimes.com/singapore/environment/spore-taps-satellite-signals-to-monitor-air-moisture-to-better-predict-weather-amid-climate-change,S'pore taps satellite signals to monitor air moisture in effort to better predict weather,"SINGAPORE - Singapore is adopting a new method to better monitor the amount of moisture in the atmosphere, a move that could boost the weatherman's ability to predict severe weather and thunderstorms amid climate change. Unlike current methods that give limited and localised readings, the new method allows the Meteorological Service Singapore (MSS) to monitor moisture continuously throughout the entire atmosphere by using satellite signals. As air moisture distribution in the atmosphere influences rainfall, the continuous stream of data could help the MSS better predict the weather, which is expected to turn erratic with global warming. The new method, which will be used from late August, makes use of satellite signal readings from 10 so-called reference stations dotted across the island. These ground stations receive satellite signals and are being used to help determine the positions of people and vehicles to make navigation more reliable. Water vapour in the atmosphere causes delays in the time taken for satellite signals to reach the stations, hence the amount of moisture in the air can be determined by the time taken for signals to reach the stations. The distribution of moisture in the atmosphere determines whether an air column is stable or unstable, said weather and climate scientist Koh Tieh Yong of the Singapore University of Social Sciences. An unstable air column leads to rain and storms, he explained. MSS uses an islandwide network of sensors on the ground to measure air moisture near the surface of immediate areas around the sensors. The MSS also releases a weather balloon twice a day to track conditions higher up in the atmosphere, up to 37km in the air. Its measurements of wind speed, temperature, air pressure and moisture can inform the MSS of the weather over large areas of the island. However, under rapidly changing conditions such as the convergence of winds over Singapore, the balloon's readings taken over the eastern part of the island may not match what is happening in the western part, for instance. The new method is aimed at plugging this gap. It is also less expensive than weather balloons to run. On Aug 2, the Singapore Land Authority (SLA) inked a five-year agreement with the National Environment Agency (NEA) to share atmospheric moisture data from SLA's network of nine stations. NEA, which oversees the MSS, has one station that will be added to SLA's network. Two more stations will be running by the end of this year. Using satellite signals to measure the amount of water vapour in the air is not new. Japan, for instance, has been using the method to forecast its weather for more than a decade, said Associate Professor Koh. NEA said it will conduct exploratory studies to find out if the additional air moisture data can help to better forecast thunderstorms. Apart from moisture, other elements that are key to forecasting storms include wind, temperature, atmospheric stability and large-scale weather patterns. Commenting on the new method, Prof Koh said it is unlikely to lead to quantum improvements in Singapore's weather forecast. ""In Singapore, a typical tropical thunderstorm blows past within one hour. To improve a forecast of such a storm three to 24 hours ahead, the (atmospheric moisture) data needed must be monitored to a range of about 100km to 700km, mostly outside of Singapore,"" he noted."
https://www.straitstimes.com/singapore/environment/hobbyist-moon-photographer-awestruck-by-largest-and-brightest-full-moon-he-has-seen,Photographers awestruck by supermoon and full moon ,"SINGAPORE - Every month for slightly more than a year now, Mr Kuick Chik Hong would place his telescope on a chair along the corridor of his 12th-floor Yishun Housing Board flat to take a picture of the full moon. It was a habit inspired by the youngest of his three sons, who is interested in the solar system, and for whom he had bought the telescope. He would place his mobile phone near the lens of his telescope to take the shots. The 45-year-old medical lab scientist was awestruck when he tried to take a photograph of the moon on Friday evening - it was the biggest and brightest that he has ever seen. ""I've never taken such a clear picture of the moon and its surface. I was quite surprised to see it so bright and clear,"" said Mr Kuick, who stays in a five-room flat with his family of five on the top floor of Block 661 Yishun Avenue 4. He has two other sons, aged 12 and 14. Mr Kuick was one of many readers who sent in their pictures of Thursday's (Aug 11) supermoon and Friday's full moon to The Straits Times. A supermoon occurs when the moon's orbit is closest to the earth. This makes the moon look brighter and larger than the usual full moon. Thursday's supermoon was the final one of the year, and is called the Sturgeon Moon. The full moon on Friday night was nearly as bright as Thursday's supermoon, said Science Centre Singapore. It also coincided with the 15th day of the lunar seventh month. For Mr Kuick, Friday's moon shot was a treat as the supermoon on Thursday was shrouded by the clouds. He said: ""My youngest one was very excited and shouting 'First time I can see the moon surface clearly.'"" ""It's fun to moon-watch. It feels good standing outside the house at night. There is a sense of achievement from capturing clear pictures of the moon."""
https://www.straitstimes.com/singapore/environment/giant-panda-cub-born-in-singapore-celebrates-first-birthday,"Le Le, first panda cub born in S'pore, celebrates first birthday","SINGAPORE - Le Le, the first giant panda cub born in Singapore, celebrated his first birthday on Friday (Aug 12) with a three-tier ice cake stuffed with carrots, bamboo, edible flowers and apple slices. To clicks of cameras from media photographers and some visitors, the cub was let into the Giant Panda Forest enclosure in River Wonders at 10am. He wandered around the enclosure briefly before making his way to the ice cake, which he climbed and fell off from a couple of times. Le Le also tore down a decorated drawing of his mother Jia Jia, which was placed to emulate a zhuazhou - a Chinese ritual held when a child turns one to pick up objects related to career or personality trait. His mother, 14-year-old Jia Jia, joined the party shortly after, encircling the ice cake before settling down to munch on her bamboo. Weighing about 200g at birth, Le Le tips the scale at more than 33kg now.  Project manager Neeti Warrier, who visited the Giant Panda Forest yesterday morning with her husband and two sons, did not expect the cub to grow so fast. The 37-year-old said: “I didn’t expect Le Le to be this big since it’s my first time seeing him today.” Clad in a customised t-shirt of Le Le specially made for the occasion, operations director Tie Boon Ping, 55, said that the cub is not only “very adorable” but also “a symbol of our bilateral ties and friendship with China” He visits the pandas at least twice a month but specially took leave on Friday for the celebration.  Le Le marks one year of age with several milestones. While he is still mainly reliant on his mother's milk, he has started to eat solid food such as pellets and carrots since June. Zookeepers have also started training him to allow them to perform routine medical procedures on him, using pellets as treats. The birthday celebrations will continue on Sunday. Fans of Le Le can catch him celebrating his birthday - with another cake - at 10am at the Giant Panda Forest. Le Le was born to giant pandas Kai Kai and Jia Jia at about 7.50am on Aug 14 last year - their firstborn since they arrived in Singapore in 2012 on loan from China. It took them seven attempts to conceive the cub."
https://www.straitstimes.com/singapore/environment/new-st-video-series-spotlights-local-solutions-to-global-problem,New video series spotlights local solutions to global climate change problem,"SINGAPORE - Climate change is a global problem, but its impact is not felt by all countries the same way. Singapore, for example, may be affected by some climate shifts more than other nations. For one thing, the city's urbanised environment is making it hotter than the global average. Singapore's dependence on food imports also makes it vulnerable to global supply chain disruptions. Still, the Republic is taking steps to deal with these vulnerabilities, with people and organisations in Singapore coming up with new innovations that can not only cushion the climate impacts on the country, but also help the nation cut its carbon footprint. Some of these local solutions to global environmental challenges, such as climate change and biodiversity extinction, will be showcased in a new video series by The Straits Times. Called Our Better Nature, the six-part series is hosted by ST environment correspondent Audrey Tan, and will be screened on ST's website and social media channels. The first episode, which airs on Tuesday (Aug 9), zooms in on how companies and researchers in Singapore are safeguarding the country's food security through high-tech farming and by developing plant-based protein. The other episodes will look at other ways the country is charting a more sustainable future under the Singapore Green Plan 2030. These include, for instance, how Singapore is making its urban cityscape more conducive for the island's other dwellers - native wildlife - and how innovations such as heat-reflective paint can help people in Singapore beat the heat. Each episode is between six and eight minutes long, and will be aired once every fortnight. The series is brought to you by the Ministry of Sustainability and the Environment."
https://www.straitstimes.com/singapore/environment/whats-in-a-name-6-animals-named-after-singaporean-naturalists,What's in a name: 6 animals named after Singaporean naturalists,"SINGAPORE - Besides the severity implicit in the use of Latin, naming a new species can also serve either a practical purpose - describing things they resemble, for instance - or be driven by emotion, such as when paying homage to a collector. The tiny Neopalpa donaldtrumpi moth with its golden ""mop"", for example, was named after former US president Donald Trump. Ahead of National Day on Tuesday (Aug 9), The Straits Times explores some stories behind creatures found here and abroad that were named after Singapore's very own naturalists. Endemic to Singapore, the pair of tiny armoured spiders of the same species - Singaporemma lenachanae - were named after Dr Lena Chan and have not been seen outside of the Bukit Timah Nature Reserve so far. The rare spiders were named after the senior director of the National Parks Board's international biodiversity conservation division by arachnologists Lin Yucheng and Li Shuqiang in 2017. The intent was to honour Dr Chan for her role in facilitating research collaboration between Singapore and academics from China. The common but little known Lebinthus luae cricket found in Singapore and Indonesia is named after former insect curator of the then Raffles Museum of Biodiversity Research, Ms Lua Hui Kheng. It was identified in 2013 by National University of Singapore (NUS) postdoctoral researcher Tan Ming Kai and Dr Tony Robillard from the French National Museum of Natural History. They dedicated the cricket to Ms Lua as she had welcomed Dr Robillard from France to the collection, which she had tended to since the 1970s, when he first visited Singapore. ""Around the same time, she also welcomed me as a (full-time national serviceman) and taught me basic entomological skills such as specimen pinning, labelling and curation,"" said Dr Tan. The insect has since been a good study subject on human impact, said the 32-year-old, citing a recent study on how reduced activity during the circuit breaker affected the calling behaviour of different populations of this cricket species in Singapore. Former NUS Lee Kong Chian Natural History Museum director Peter Ng has a knack for naming crabs after a number of his colleagues, including fish scientist Tan Heok Hui. The Polyonyx heok marine porcelain crab was christened as such because Dr Tan had collected it during a dive for the Comprehensive Marine Biodiversity Survey of Singapore. The reddish brown crustacean is uniquely found living in the tube home of a worm. While most of the taxa named after Dr Tan fell into his net at one time or another, there is one exception: the Dendrobium heokhuii orchid that the late orchid specialist Peter O'Byrne named after him for discovering the world's smallest fish in 2006. On top of his spider collection, which includes more than 12,000 specimens, former diplomat Joseph Koh has no shortage of arachnids bearing his name. For example, the Tetragnatha josephi, or mangrove long-jawed spider, was named after Mr Koh by the late Japanese arachnologist, Dr Chiyoko Okuma, in 1988. The native species was first collected by Mr Koh in mangrove swamps at Lim Chu Kang and subsequently found also in mangroves in Malaysia and Brunei, said Mr Koh. ""Dr Okuma decided to call it 'josephi' instead of 'kohi', because 'kohi' sounds like 'coffee' in Japanese,"" Mr Koh told The Straits Times. Another species, the Anelosimus kohi spider, was named after him by the late Dr Hajime Yoshida in 1993 as the scientific description of this species was based on the specimens Mr Koh had collected in the mangroves fringing Sungei Seletar. Like the recently discovered species of moss animal named after her, marine conservationist Ria Tan has a strong attachment to marine life, said NUS marine biologist Huang Danwei. Moss animals are some of the most common but sometimes inconspicuous creatures that attach to underwater surfaces and fall under a group of marine life called Bryozoa. The bryozoan Reptadeonella riatanae was named after Ms Tan for the monumental efforts she has put in for over two decades, all the time as a volunteer, to promote knowledge on marine biodiversity through her web resource Wild Singapore, as well as in person, said Assistant Professor Huang, one of the scientists to help discover the species. Noting the permanence of a scientific name, he added: ""In that sense, it is an immortalisation of her name in the scientific record. ""Specifically, we wanted to acknowledge in a very real and permanent way Ria's significant contributions to marine biodiversity and conservation in Singapore, so that her work will continue to be an inspiration to the marine community and the public at large."" In June, a newly discovered paddy frog - the first new frog species to be described here in nearly 40 years - was named after the late environmental consultant Subaraj Rajathurai. The Micryletta subaraji frog, or Subaraj's paddy frog, was named so to commemorate Mr Subaraj, who died in 2019 and had been a good friend and nurturing mentor to the co-authors of the paper describing its discovery. The veteran nature guide fought to conserve Singapore's remaining wild spaces, including the Sungei Buloh Wetland Reserve, as well as his active involvement in protecting them amid new infrastructure projects such as the Cross Island MRT Line."
