Link,Title,Content
https://www.straitstimes.com/singapore/environment/reticulated-python-swallows-6kg-pet-cat-in-tanah-merah-condominium,Reticulated python swallows 6kg pet cat in Tanah Merah condominium,"SINGAPORE - A reticulated python swallowed a pet cat roaming the condominium compound of its owner's house in Tanah Merah. Teacher Angel Low, 28, feared the worst when her cat, Ben, did not return home on Monday night, after she learnt that a reticulated python with a bulging belly had been caught earlier that day. ""Ben usually comes back when my mum calls him. We suspected that something was wrong when we saw the python's belly in a video shared by other residents and immediately contacted the Animal Concerns Research and Education Society (Acres), which had removed the snake,"" said Ms Low. Her three-year-old tabby cat weighed about 6kg, she said. To her family's horror, they learnt the next day that the python had vomited their pet's carcass while the reptile was being transported to the Singapore Zoo. But it was too late for them to retrieve the carcass, which was thrown out by staff. ""I wish they had been a bit more sensitive in handling the issue... especially when my cat had a collar,"" said Ms Low, who felt that the staff could have taken the trouble to find out if the cat belonged to someone. Responding to queries from The Straits Times, Mandai Wildlife Group and Acres said the python was taken to the group’s animal hospital, which is the central processing point for all rescued pythons in Singapore. On the way to the hospital, the snake regurgitated the cat, and when scanned at the hospital, the carcass had no microchip indicating its origin, they said. “Acres made a call to the security officer to provide an update and was informed that no reports of a missing cat had been made up until then. After a discussion between the two organisations, the body was carefully disposed of, in accordance with the zoo’s standard protocols for biosecurity,” they added. Following the incident, the veterinary department at Mandai Wildlife Group is reviewing its processes to temporarily keep dead domestic animals taken to the hospital, they said. This was the first time Ms Low and her family, who live in a three-storey house, had seen a snake at D'Manor since they moved into the estate more than 10 years ago. Ms Low said they were surprised to see one as the condominium is not near any nature areas. ""My mum is devastated because she was very close to Ben, whom we've had since he was one week old. He was a very sweet cat that wouldn't hurt anyone and would cuddle up to us when we were upset."" ""Every time we think about what happened, we still cry,"" she added. Ben liked to sun himself so the family allowed him to roam the compound, she said, adding that the cat would return home on its own. After the incident, they are now more vigilant of the whereabouts of their six-year-old dog and two other cats. Reticulated pythons, which are native to Singapore, can grow up to 10m and eat mammals ranging from mice to deer, according to the National Parks Board's (NParks) website. They have been known to devour pets, including cats, birds and dogs. Reticulated pythons are regularly spotted in urban storm drains and play an important role in controlling the population of rats, said Mr Sankar Ananthanarayanan, president of the Herpetological Society of Singapore. He added: ""Our hearts go out to the family of the cat, and we sincerely hope they find closure from this incident. ""These animals do not mean us any harm. It is advisable not to let house pets outdoors unsupervised. In general, keep a safe distance from wildlife."" Said Acres co-chief executive Kalai Vanan Balakrishnan: “While such occurrences of snakes preying on pets are not common,  we are living in increasingly integrated environments that may result in more wildlife encounters. “It is advised to keep a close eye on pets when outdoors and use a leash if possible or keep pets safely indoors for the well-being of both the pets and other wildlife such as snakes.” People who come across snakes in a public area or on their property should call NParks’ 24-hour Animal Response Centre on 1800-476-1600. 
 "
https://www.straitstimes.com/singapore/environment/ted-chen-evercomm-rolex-we-the-earth-singapore-sensors-eco-warrior-sustainability-environment,Data to counter climate change: How his firm gets everyone to play a part in protecting the planet ,"  Dealing with climate change may seem like something that requires global action, but this company believes every person can lessen their impact with their tech innovation. You may look for the energy star when buying appliances, replace lights, and use renewables, but have no idea how much carbon footprint you are actually reducing.  A pilot project tracking local carbon emissions, between sustainability business Evercomm and the Pan Pacific Hotels Group, aims to keep you informed about how you’re helping to protect the environment on your next staycation. In the near future, guests at the group’s hotels in Singapore will get a breakdown of their electricity and water usage, and resulting carbon dioxide emission, at the end of their stay.  With this awareness, Mr Ted Chen, 32, Evercomm’s co-founder and chief executive, says: “We hope that this will motivate people to make simple changes to limit their carbon footprint.”.   His keen interest and desire to develop ways to conserve energy started in his years as an undergraduate at Nanyang Technological University (NTU) in the late 2000s. He and his fellow electrical engineering coursemate Phyo Ko Ko took part in hackathons on energy management, where the idea for their business evolved. Mr Chen and co-founder and chief innovation officer Mr Phyo, 37, set up Evercomm in 2013. “I was interested in sustainability and engineering, and it made sense to try and merge my two passions,” Mr Chen shares.  With advice from NTUitive, the university’s innovation and enterprise incubator, they refined their pitch and landed GlobalFoundries as their first customer in 2013. Still, the company’s early years were a struggle.  Mr Chen recalls: “Sustainability was not mainstream back then. The only firms that showed some interest were the large industrial entities – semiconductor firms, data centres, high-end manufacturers – because they used a lot of energy and could cut costs. Even then, it took a lot of convincing because they were not sure the effort would be worth the savings.” Evercomm offered free trials of its technology that lasted four to six months, to prove its value proposition. “The moment we showed them the data from their production floor, how much wastage there was and how much they could save, most of them came on board.”  Since then, Evercomm has helped hundreds of companies to find cost-effective ways to minimise their energy, water and other resource use, averting four tonnes of carbon emissions annually. Evercomm has offices in Singapore, Malaysia, Thailand, Myanmar and Taiwan, and counts semiconductor giant GlobalFoundries, the National Dong Hwa University in Taiwan, and the General Electric conglomerate as its clients.  “We use sensors and artificial intelligence to answer three essential questions for firms: how much they are consuming, how much they actually need, and how much they are wasting. It is amazing how much you can save just by optimising existing equipment,” he explains.  The Singapore government has lauded the firm for “addressing global problems such as food wastage, climate change and excessive energy consumption”.  As the company sought to win clients, it worked on improving its offerings.  “At the beginning, we had analysts who studied the collected data to make cost-cutting recommendations, but we realised this was not so scalable, so we invested in artificial intelligence and machine learning algorithms. These can self-learn and tailor solutions for different firms,” says Mr Chen, who was named one of Forbes magazine’s 30 changemakers under 30 years old to watch in Asia in 2016, in the manufacturing and energy sector. “For a factory that produces around the clock, our system can suggest more efficient settings for equipment that cannot be switched off. For a site that does ramp down regularly, it can optimise the production schedule to save even more electricity. There are lots of ways we can finetune operations.” By 2019, more businesses and organisations had signed onto Evercomm’s sustainability vision.  The National Dong Hwa University, for instance, has saved between five and 10 per cent in its electrical consumption by using Evercomm’s energy analytics system.  “By combining software and sensors, we can track, among other things, how much cooling a room needs, and adjust the cooling system’s air flow and temperature,” Mr Chen says. The firm is currently replicating its approach for Thailand’s Chiang Mai University. While the Covid-19 pandemic threatened to derail the company’s growth, it surprisingly accelerated it instead.  Mr Chen elaborates: “The start of the pandemic was difficult. Many of our hospitality customers were out of commission, and even manufacturers weren’t thinking about optimisation anymore.” Evercomm pivoted to marketing its systems as digital solutions for firms trying to cope with manpower restrictions. Food businesses used its monitoring technology to keep tabs on the temperature of their warehouses, cold rooms and freezer rooms, so they did not have to deploy staff to check and record the temperatures every few hours.  With the pandemic raising awareness of sustainability issues, and governments worldwide committing to green development plans, however, demand for Evercomm’s services not only recovered but soared. “Before Covid-19, we were signing seven to 10 customers per year. Last year, we had nearly 70 new customers. It’s clear that there has been a big change in the attitude towards sustainability,” Mr Chen says. Sources: Global Alliance for Buildings and Construction and Building and Construction Authority   The company has found a new niche too, in helping firms to collect and verify the data that they need to apply for green loans from banks and other institutions. It also co-founded CO2 Connect, an online platform launched in October last year, to enable small and medium enterprises to easily track their carbon footprint for benchmarking, green certification and other purposes. Mr Chen, who has consulted for and partnered with the United Nations Development Programme on several projects, including advising the Philippines government on how to promote green financing, stressed the importance of advancing sustainability.  “If you look at the Asia-Pacific region, we are not on track for any of the United Nations’ Sustainable Development Goals. None. The impact of climate change is only going to get worse, and more countries, more people and more businesses will be affected,” he says.  “We need to do more to support a grassroots approach to sustainability, so that everyone is involved in protecting the planet for our future.” We The Earth is a partnership between The Straits Times and Rolex and its Perpetual Planet initiative. Mr Ted Chen from Evercomm is a stellar example of the many individuals who are doing their part to solve the issues earth faces. "
https://www.straitstimes.com/singapore/environment/kids-share-your-climate-story-with-st,"Kids, share your climate story with ST ","SINGAPORE - What do you think the future holds for you and your friends when it comes to the environment?  Will you be living in a decaying world, hit hard by climate change? Or perhaps mankind – including you and your friends – will have come up with a way to save the earth and its living flora and fauna?  The Straits Times (ST) and Little Red Dot want to hear from you on what you think your climate future might look like. We are seeking your most creative and imaginative eco-related stories. They can be fiction or non-fiction, as long as they are original ones you have come up with. The best stories will be brought to life for a climate special by ST that will feature your voice, pre-recorded in our studios, alongside an illustrated version of your story created by our team. The top three entries will also receive $100 in vouchers, as well as some ST gifts such as a backpack, a mug and cute notebooks. Pick one of the following topics and tell us your climate future story. We’d love to hear your voices, so record an audio story about 1 to 2 minutes long. If you’d prefer to write your story, try to keep to 300 words. The topics are: ● Hotter temperatures ● Rising sea levels ● Protecting our wildlife ● Climate careers Read below for more on each topic, submission guidelines, teacher tips and terms and conditions. 1. Submit all entries by Sept 9, 2022, with your name, school and parent’s e-mail address. Each entry should be submitted to stschools@sph.com.sg with the audio or word file as attachments. 2. If you are sending a word document, please use Arial font size 14. The story should also be double-spaced. Please include your full name, school, and class at the top right-hand corner of your document. Save your document in this format: YourName.docx or YourName.pdf. 3. All entries should adhere to the word limit of 300 words and should be written solely by yourself. You should not ask an adult to write the story for you. Entries found to have been plagiarised or written by someone else will be disqualified. 4. The judges’ decision is final and no negotiations or correspondence with entrants will be entered into. It could be hot, hot, hot – 40 deg C on some days – by 2045 here. You would be in your 30s: Imagine the unforgiving sun beating down on your back as you dash out at lunchtime to buy lunch. Should you care? After all, you could simply turn the air-conditioner to a lower temperature, and turn up the fan to a higher speed. Well, yes. Today, the effects of a warmer world are felt most harshly by people who work outdoors – from engineers and architects who survey work sites, or even physical education teachers to gardeners – as well as people who live in less ventilated places.  The elderly also suffer more, as their bodies are more prone to heat-related illnesses. For instance, their sweat glands may be less efficient, so they are unable to lose excess heat easily. Other than humans, animals suffer too. For instance, cattle that are overheated will produce less milk and are less able to conceive. The warmer oceans and seas also are causing algal blooms (when algae grows rapidly on the water surface), bleaching corals and decreased oxygen levels in the water. How else do you think warmer temperatures would hurt this earth and its inhabitants, and what do you think your role would be? While the effects of climate change will likely be different depending on each region, life is set to get harder for everyone everywhere around the world. Erratic climate conditions means that not only are some places facing searing heat, but that many others are facing another catastrophe – rising sea levels.  Many coastal or low-lying areas are already facing the threats of constant floods, as increasingly warm temperatures cause the ice at the earth’s poles to melt.  Besides disrupting the habitats of animals such as polar bears and penguins, the melting ice will also flow into the oceans. Since water expands when it becomes warmer, it will take up more space in the oceans, which will raise sea levels. Low-lying areas may become submerged in the future. Singapore is one of the countries that is facing that risk. The country has experienced some of its worst flash floods in the last few years. With climate change, this could get worse. About 30 per cent of all land in Singapore is less than 5m above sea level. Because of that, the country is already taking steps to protect its coasts. One way it is doing that is by conducting studies that will help develop coastal protection measures for Singapore’s coastlines. Another way is to ensure that new developments will be built at least 5m above sea level. How else do you think rising sea levels would hurt this earth and its inhabitants in the future, and what do you think your role would be? Climate change is hastening the loss of animal species and habitats all around the world. When animal species and habitats disappear, in a process called biodiversity loss, food supplies, jobs, economies and human health are threatened. However, many conservation projects around the world are helping to bring back endangered and extinct wildlife species. For example, in Australia, an endangered mammal has been reintroduced after disappearing more than 100 years ago. The brush-tailed bettong, also known as the woylie or “rat kangaroo”, is about the size of a rabbit and moves around with a springy hop. While it used to be found in many areas in Australia, experts said that the species was almost wiped out when cats and foxes were introduced by Europeans.  Last year, 12 male and 28 female woylies were reintroduced to South Australia. Woylies help to improve habitats for other species by dispersing seeds and nutrients while digging up tonnes of soil. Meanwhile, an endangered wild horse species known as the Przewalski’s horse was once extinct in China. But now, the country is home to 800 of the horses after the species was first reintroduced in 1985. There are many animal species that are native to Singapore. What role do you think you can play in the future, should any of them face the danger of extinction? Right now, car mechanics may mostly do repair work on “traditional” vehicles that run on petrol. But in the future, they may need to improve their skills so that they can repair an electric vehicle.  Likewise, a power engineer who is keen to be part of the green economy may need to learn more about hydrogen, solar and other renewable energies.  As Singapore works towards its sustainability goals, many workers here are keen to explore green jobs. Companies are also eager to hire workers to fill these roles. However, for the moment, firms here have not created enough of such jobs. And employees have not acquired enough green skills to take on the scarce openings that are available. This was the picture painted by several studies published earlier this year by various websites and consultancies. To address that, Singapore plans to provide more opportunities for people to equip themselves with the relevant skills so that they can benefit from the growing green economy. One example of a company that has taken steps to train its staff in sustainability is OCBC. Last year, the bank launched a suite of sustainability training modules to groom more subject experts within the bank. At that time, it had also created more than 50 sustainability-related jobs within the bank across various areas such as sustainability research, ESG (environmental, social and governance) assessment, and community development and environment conservation programmes. What sort of green jobs do you think would be available in the future? What role would you like to play in the green economy? Most young writers dive into developing their plots and characters to make their stories convincing. However, every good story needs a time and location to take place in – its setting. Your story’s setting will lend a sense of realism to your plot, and keep your reader engaged through the following ways:  1. Instead of merely describing the environment in your story, show how the characters interact with it, and how they feel being in that place. 2. Focus on details when describing your setting. If your story is set in the daytime, do not simply say it was a hazy morning. Describe how the sky looked or the air smelled like so that you can paint a vivid picture for the reader. 3. Use actual locations or buildings around you for inspiration. If your story takes place in the distant future, think about how such buildings will change in appearance as time passes, and describe those changes in your story as your character experiences being in these places. 1. Avoid having too many characters in a short story.  Having one or two main characters allows you to focus on developing their thoughts and feelings as the plot progresses. Try to refrain from having too many minor characters as this would mean your main character ends up as a very superficial figure in your short story. 2. The background of a character can be told through flashbacks. The past experiences of your main character allows the reader to understand his or her feelings better. 3. To make your characters more interesting, reveal their inner conflict through their reactions to events in the plot. For instance, take the time to elaborate on a character’s feelings when he realises something is beyond his control. Suspense in any short story gets the reader riveted to the storyline. Here are ways you can build a sense of excitement in the reader. Foreshadowing is a technique that writers use to hint at something that will occur later in the story. One type of foreshadowing could be through a detailed description of the setting. For instance, if your story does not have a positive ending, then you might foreshadow the conclusion with storm clouds in the distance to hint that danger is about to occur. Another way to build anxiety or uncertainty is through the use of onomatopoeia. This refers to the use of words that imitate the sounds one is trying to describe, such as “shriek”, “crash” and “creak”. These sound effects help to build suspense as your reader is provoked into an emotional response while reading your story. Try ending your short stories with the following methods: 1. Open endings Not every good ending has a resolution for your characters. Stories with open endings leave the reader guessing what might happen next. Such unexpected endings add an element of surprise and may even contain a twist in the tale. 2. Endings with reflections or morals of the story Though these may seem predictable, such stories tend to give personal insight, and can allow the reader to also ponder about an important life lesson, or the writer’s main message. 3. “Full circle” endings Such endings are challenging to write, as you will have to plan your plot cleverly such that the story ends as close as possible to how it begins. For instance, if your story begins with your main character standing on the beach looking at the sunset, it could end with him on the same beach, at sunrise. 1. Winners agree to grant and assign SPH Media the copyright and intellectual property rights to publish the work as it sees fit. 2. The organiser will get in touch with winners’ parents or guardians to administer the logistics. Some personal data may be collected in connection with administering or managing these logistics"
