Link,Title,Content
https://www.straitstimes.com/singapore/environment/years-of-trial-and-error-bear-fruit-as-native-bird-species-raises-young-on-pulau-ubin,Years of trial and error bear fruit as native bird species raises young on Pulau Ubin,"SINGAPORE - After years of trial and error, efforts to get the blue-throated bee eater - a bird species under the National Parks Board’s Species Recovery Programme - to nest here have finally borne fruit. On Saturday (June 25), NParks said that 21 occurrences of successful nesting have been recorded, with the current breeding season still ongoing. Group director of conservation at NParks Lim Liang Jim told The Straits Times that while the birds are native to Singapore, they rarely nest as sand banks and high river cliff banks, where the birds typically like to nest, are hardly present here. Since 2016, a site in Ketam Quarry - a disused granite quarry - has been converted into a bird nesting area that caters to the different nesting requirements of three targeted bird species, including the blue-throated bee eater. The birds dig holes in sand banks, which they use as nests. ""We looked at what conditions were needed when they were breeding overseas - sand banks and cliff banks - so we decided to pile up a mound of sand,"" he said. ""From then on we went through several years figuring out what was the optimal way to arrange the sand to that the birds are happy to use it."" Mr Lim said several ways were experimented with, such as adjusting the gradient of the mound. ""We even put in plastic tunnels for them, to encourage them to explore, but they didn't seem to like it,"" he said. After several rounds of trials, those working on the breeding site found last year that a mound of sand about 3m to 5m tall was stable enough for the birds to feel comfortable digging nests in it and laying their eggs. The angle of the mound's slope also mattered, said Mr Lim, who added that at a gentler slope, the birds could feel threatened that predators would climb the mound and steal their eggs. After pairs of birds had nested, equipment was brought in to monitor the success. ""When we felt certain that there were chicks inside the nests, we waited for the parents to fly away and we went in with an endoscope to see how many eggs were laid, how many hatchlings there were,"" he said. ""We have a lot of very cool footage of them bringing back food for the babies, having the babies come out for the first time and endoscope videos of the babies moving inside the nest."" NParks also said its species recovery efforts have benefited two other bird species - the baya weaver and the red-wattled lapwing."
https://www.straitstimes.com/singapore/environment/vaccination-centres-busier-this-week-as-more-aged-50-and-above-go-for-booster-shots,Vaccination centres busier this week as more aged 50 and above go for booster shots,"SINGAPORE - More people aged 50 and above have gone for their first as well as their second Covid-19 booster shots, as vaccination centres saw higher footfall this week than in previous weeks. Parkway Shenton, which runs a vaccination centre in Hong Kah, said about 30 per cent more people turned up at the centre this week compared with the week before. On Saturday (June 25), when operations ended at 1pm, more than 120 people had taken their booster shots at Commonwealth joint testing and vaccination centre (JTVC), a higher than usual number compared with recent weeks. The centre also said footfall for this week is double that of last week, although it declined to provide exact figures. The higher numbers come as people aged 50 to 59 were from June 10 added to the older age groups that are being offered a second booster. There are also 80,000 people aged 60 and older who have yet to take their first booster jabs, Health Minister Ong Ye Kung had said on Monday. It was a busy first weekend for the new Bukit Merah JTVC, with seven to 10 people already waiting in line outside the centre in Lower Delta Road at 8.45am on Saturday, before the centre opened its doors at 9am. By 10.30am, the centre had seen between 30 and 50 people. JTVCs are open till 1pm on Saturdays and 7pm on weekdays. The Bukit Merah centre was one of five new JTVCs that started operations on Thursday, bringing the total number of such facilities to 10. Kidney transplant patient Katherine Goh, 53, was among those who took their booster shots at Commonwealth JTVC on Saturday. She was taking her fourth shot, but it is considered the first booster as those with weak immune systems require three shots for their primary vaccination course. She said three weeks after getting her third jab in January this year, she caught the virus amid the Omicron wave. She tested positive for about three weeks, and also spent a night in hospital when she had chest tightness and breathing difficulties at one point. Ms Goh, who is unemployed and lives with her husband in Bukit Timah, had two kidney transplants - one in 2001 and another in 2018. ""For me, vaccination is not encouraged, but a necessity."" Also at Commonwealth JTVC were Ms Ng Ai Choo, 59, and her 80-year-old mother, who were there to take their second booster shots. Ms Ng wanted her mother, Madam Ng Leh Tien, further protected, because she goes for daily physiotherapy at Apex Rehab Centre in Bukit Merah View, and mingles with other seniors. For seniors aged 80 and older, protection against severe disease from the virus with three doses is lower, and a second booster is needed to protect them further, the Ministry of Health (MOH) has said. Ms Ng, a housewife, said she was spurred to get her fourth shot as she is wary that another Covid-19 wave may be on the horizon. Mr Ong had previously warned that Singapore is likely to see another Covid-19 wave in July or August this year. This will be driven by the BA.4 and BA.5 Omicron sub-variants, which are more transmissible, but have not been linked to higher hospitalisation and deaths. On Tuesday, MOH said these variants accounted for around 30 per cent of all virus cases in the past week. As at June 22, 78 per cent of the total population have taken their booster shots. Professor Teo Yik Ying, dean of the Saw Swee Hock School of Public Health at the National University of Singapore, said: ""It is my opinion that eventually, almost everyone in Singapore will be infected with Covid-19 at some point in their lives, and when that happens, we want to ensure the risk of severe disease and death is as low as possible."" Mr Karl Kleemeier, 58, was among those who took their second booster shots at Bukit Merah JTVC on Saturday. The head of market data provider Argus Media's Singapore office has been diligent in getting his jabs when the opportunities came, because he knows how potent the virus can be, having been infected while in Saudi Arabia in May 2020. ""I was in hospital for two weeks. I had pneumonia, fever, night sweats, and I was on oxygen,"" he recalled."
https://www.straitstimes.com/singapore/environment/pulau-ubins-main-village-may-have-up-to-90-of-electricity-from-solar-by-2023,Pulau Ubin's main village may have up to 90% of electricity from solar energy by 2023,"SINGAPORE - By 2023, Pulau Ubin's main village could have up to 90 per cent of its energy needs powered by the sun, thanks to an upgraded power grid. The upgraded grid was among the enhancements to Pulau Ubin that Minister for Culture, Community and Youth Edwin Tong announced on Saturday morning (June 25) at the annual Ubin Day event. Mr Tong also said that personal alert buttons have been installed in the homes of elderly villagers by the National Parks Board (NParks) and GovTech, under a trial. This allows seniors to quickly call for assistance in emergency situations. He said fire hydrants and hose reels will also be installed in the island's main village, as well as at Kampong Sungei Durian and Ubin Living Lab (a facility for field studies and environmental education) to strengthen the island's fire management response. Previously, all households were given fire extinguishers as part of a larger initiative to improve facilities on the island. Mr Tong was joined at the event by National Development Minister Desmond Lee and NParks chief executive Kenneth Er. NParks is the central managing agency of Pulau Ubin. The Pulau Ubin Micro-grid was launched by the Energy Market Authority (EMA) in 2013 to provide more than 30 of the island's residents and businesses with a more reliable, cleaner and affordable electricity supply than diesel-powered generators. EMA's Industry Development Department director Jeanette Lim told The Straits Times that when the grid was launched, about 15 per cent of the daily electricity demand was supplied through solar energy, while the remainder was supplied by diesel-powered generators connected to the grid. Besides making the grid's energy supply cleaner, EMA said on Saturday that NParks will be extending the grid's coverage beyond the island's main village to Kampong Sungei Durian, where 13 households will benefit. ""This will help address the villagers' request for a cleaner and more reliable electricity supply and raise their quality of life,"" said the authorities. The grid is operated by EDPR Sunseap APAC. Ms Lim said those who consume energy from the grid pay a fixed rate of $0.80/kWh, which is lower than the cost of operating their own diesel generators, which was about $1.20/kWh. To optimise the grid's solar photovoltaic (PV) system's output, its operators will add plants next to solar panels to create a ""solar green roof"". This reduces the ambient temperature of solar PV systems by 3 deg C to 8 deg C, increasing its efficiency by 1.5 per cent to 4 per cent. An energy storage system will also be deployed to help improve the reliability of the grid. A provision shop owner in the island’s main village, Madam Ng Ngak Heng, said on Saturday that she started using the grid in 2014, she has not needed to use her own diesel-powered generator, which has reduced noise and smoke pollution. While the 72-year-old, who has lived on Pulau Ubin for the past 47 years, said purchasing electricity from the grid has been more expensive than using generators in her experience, she appreciates the convenience of no longer needing to fill up and operate the generator, which can be a laborious process. Meanwhile, Ms Ong Ah Sam, 84, who lives in one of five houses where the personal alert buttons have been installed, said being able to call for help easily gives her peace of mind. “It’s easy to use and more fuss-free than picking up a phone and then looking for a number,” she said of the buttons, which are installed at about waist-height and will allow her to call for help with a push of the button. On Saturday, Mr Tong also gave updates about species recovery and habitat enhancement efforts NParks has undertaken over past years. For instance, since the development of nesting sites for the blue-throated bee-eater, a species under NParks Species Recovery Programme, NParks has recorded 21 nesting occurrences. Monitoring of the current breeding season is still ongoing. Meanwhile, the enhancement of Pekan Quarry with floating wetlands has successfully increased the area of usable wildlife habitat for birds, leading to more sightings of herons, kingfishers and waterhens in the area. A first breeding of the lesser whistling duck at Pekan Quarry was also recorded this year. ""It was only last year that we first spotted a pair of them using the floating wetlands and floating logs to roost,"" said Mr Tong. ""Now the two ducks have grown their own family."""
https://www.straitstimes.com/singapore/environment/new-initiative-aims-to-help-green-singapore-and-raise-funds-for-social-causes,New initiative aims to help green Singapore and raise funds for social causes,"SINGAPORE - A new project that aims to help green up Singapore's urban areas and raise funds for social causes was officially launched on Friday (June 24) by community-based initiative Target15.sg. The Hold-a-Hand Project is facilitated by Target15.sg, a community-based initiative launched by events management company Circus Maximus International. The project involves the initiative partnering with organisations such as schools to grow 150,000 trees over the next five years on their premises from seeds or seedlings sourced from partner nurseries in Malaysia and Indonesia. Once the trees reach a suitable size, they will be transplanted to other areas in Singapore, including nursing homes, religious institutions and properties like condominiums and shopping centres. Mr Edward Kent, 55, founder of Target15.sg and managing director of Circus Maximus International, said the initiative aims to complement Singapore's target of planting one million more trees islandwide by 2030, and also supports Singapore's 2030 Green Plan. Target15.sg has collaborated with St Patrick's School to germinate and nurture 1,300 tree saplings from 16 species within the school compound under the Hold-A-Hand Project. Students are responsible for caring for the young trees. When the saplings mature - which takes six months - Target15.sg will collect and donate them to nursing homes and religious institutions, helping to create a greener, healthier environment in those areas. For every viable sapling harvested, Target15.sg will also donate $30 to the school, with the money to be used at the school's discretion. It will also pledge a $2 contribution for each tree harvested to charities, including SDI Academy which is an education centre for IT and financial literacy for migrants and refugees; and migrant workers charity ItsRainingRaincoats. A variable sum was also pledged to the selected charity for Friday's event, the Singapore Muslim Women's Association. Minister for Culture, Community and Youth and Second Minister for Law Edwin Tong, who was guest of honour at the project's launch, held at St Patrick's School, said: ""(Being) green should be part and parcel of our everyday, part of our lived experiences, part of how we conduct ourselves.” He added that a mindset change is needed to make being green sustainable.  Mr Adrian Lim, head of character and citizenship education at St Patrick's School, said: ""Part of being a gentleman is not just taking care of families and themselves, but also taking care of the environment and being stewards of the environment."" Among the 1,300 tree saplings being cared for by St Patrick's School, are 500 moringa trees - whose leaves and fruits are often used by migrant workers from Bangladesh and India in their food and drinks. The Rotary Club pledged $250 per tree to St Patrick's School to underwrite the cost of the trees. Upon harvest, these trees will be donated to the migrant worker community. The first 100 moringa trees nurtured by St Patrick's have been harvested and were donated at the event, to be planted in migrant worker dormitories across the island. Mr Kelvin Wee, 60, commercial director of Target15.sg, said that planting trees within the school and collaboration within the district helps students and the various communities get involved in protecting nature. Correction note: In an earlier version of this story, Mr Kelvin Wee's full name and designation were incorrect. It has been corrected. We are sorry for the error. "
https://www.straitstimes.com/singapore/environment/singapore-begins-importing-renewable-energy-from-laos-via-thailand-malaysia,"S'pore begins importing renewable energy from Laos via Thailand, Malaysia","SINGAPORE - The Republic on Thursday (June 23) began importing renewable energy from Laos via Thailand and Malaysia - a move that marks the first multilateral cross-border electricity trade involving four Asean countries and the first renewable energy import into Singapore. Up to 100 megawatts (MW) of hydropower from Laos will be brought into Singapore using existing interconnectors under the Lao PDR-Thailand-Malaysia-Singapore Power Integration Project - an intergovernmental project set up in 2014 to study the feasibility of cross-border power trade. The 100MW account for about 1.5 per cent of Singapore's peak electricity demand in 2020 and could power around 144,000 four-room Housing Board flats for a year. The cross-border electricity flow follows an agreement inked in September last year between Keppel Electric - a wholly owned subsidiary of Keppel Infrastructure Holdings - and Electricite du Laos - the state-owned power supplier of Laos - to import renewable energy into Singapore. The two organisations have also signed an initial two-year power purchase agreement. The import will serve to test the technical and regulatory frameworks for importing electricity into Singapore, facilitating larger-scale imports from the region in the future. The power integration project is a step forward in the development of a broader Asean power grid, said the Energy Market Authority (EMA), the Ministry of Energy and Mines of Laos, Electricite du Laos and Keppel in a joint statement. ""The Asean power grid is a key regional initiative to enhance interconnectivity, energy security and sustainability through existing electricity interconnections,"" the joint statement added. ""This provides opportunities to tap on low-carbon and renewable energy sources in the region and contributes towards economic development and improving energy security and stability."" Dr Daovong Phonekeo, Minister of Energy and Mines of Laos, said his country aims to be a major supporter of renewable energy in the region. ""The country has more than 8,000MW of installed hydropower capacity, which is set to grow in the near future to support its domestic demand and future exports... This project proves that we are on the right track as we promote the development of clean energy resources, including solar and wind power,"" he said. The Republic had in October 2021 announced plans to import around 30 per cent of its electricity from low-carbon sources, such as renewable energy plants, by 2035, to reduce the carbon footprint of its power sector. At present, more than 95 per cent of Singapore's electricity is generated by burning natural gas, a fossil fuel. Burning fossil fuels produces planet-warming carbon dioxide, which contributes to climate change. The power sector is responsible for about 40 per cent of Singapore's total emissions; however, a recent report commissioned by EMA found it would be feasible for the sector to reach net-zero emissions by 2050. But land constraints in Singapore hinder the construction of large solar farms, and the country also cannot access alternative forms of renewable energy, such as wind energy or hydropower. Still, Singapore's power sector can reach its net-zero target by 2050 by importing - among other things - clean energy generated elsewhere, the report by the Energy 2050 Committee has found. Other potential solutions include developing infrastructure suitable for clean-burning hydrogen to be used as a fuel, as well as investing in emerging low-carbon technologies that will enable carbon dioxide to be captured from smokestacks before it is released into the atmosphere. Keppel Electric is the first entity to be issued an electricity importer licence by EMA. But the authority has also announced plans to import electricity from other sources. Last October, the EMA announced that YTL PowerSeraya - a generation company and electricity retailer in Singapore - would be embarking on a two-year trial project to import 100MW of electricity from Malaysia. This pilot is expected to start this year. EMA is also working with power generation company PacificLight Power on a pilot to import 100MW from a solar farm in Pulau Bulan, Indonesia. Electricity will be supplied via a new interconnector that directly connects a solar farm in Pulau Bulan to PacificLight's power station in Singapore. The pilot is expected to be commissioned by around 2024. EMA chief executive Ngiam Shih Chun said: ""The commencement of electricity imports from Laos marks a significant milestone in our regional energy cooperation... Interconnected power grids can accelerate the deployment of renewable energy, promote supply diversification, and strengthen grid stability for the region as a whole."" Dr Victor Nian, CEO of independent think-tank Centre for Strategic Energy and Resources, said that the import of 100MW of renewable energy from Laos is unlikely to have an impact on electricity prices here since the imported electricity makes up only a small fraction of the country's energy mix. But even if more renewable energy is imported into Singapore in the future, the impact on electricity prices will depend on a number of factors, including the price at which Singapore is buying the imported electricity and the quantity imported. EMA declined to reveal the cost of the imported renewable energy. Dr Nian said the energy import pilots will have to look into a number of issues to determine the feasibility of scaling up cross-border electricity flow. A key one, he noted, is how imported electricity will affect the reliability of Singapore's power grid. ""Right now, because only a small quantity of electricity is imported, any disruptions in the supply would not have an impact on electricity supply in Singapore,"" he said. ""But in the future, if more electricity is imported, Singapore will have to study how to safeguard electricity reliability in case of any supply disruptions."" Such disruptions could be caused by the intermittent nature of certain sources of renewable energy - less solar power can be harnessed on a cloudy day, for instance - and due to geopolitical situations, for example, if countries ban the export of renewable energy. Other issues to consider would be whether cross-border infrastructure could handle the transnational flow of electricity and how electricity imports would affect generation companies in Singapore. ""Would renewable energy imports replace some generation capacity in Singapore? If some generation plants were to be kept as standby in case of regional disruptions, then the impact on the business models of the generation companies would have to be studied too,"" said Dr Nian."
