Link,Title,Content
https://www.straitstimes.com/singapore/environment/old-mrt-train-parts-get-new-life-as-benches-handrails-plant-holders-in-hdb-towns,"Old MRT train parts get new life as benches, handrails, plant holders in HDB towns","SINGAPORE - Residents in most towns can expect to see new benches, safety handrails and plant holders made from old MRT train parts installed in the neighbourhood. The project aims to upcycle at least 1,500 MRT seats into benches for void decks and other communal locations, as well as 1,400 handrails that will be repurposed as safety handrails for less mobile residents. About 900 intercom panels and LED light covers found in trains will also be converted into plant holders for use in community green spaces. The upcycling effort is being undertaken by all 15 People's Action Party (PAP) town councils to repurpose old MRT train parts to cut waste and add to the community environment, the party announced on Sunday (July 17). By 2025, around 14,400kg of reinforced plastics, metals and other hard-to-recycle materials from old trains will be upcycled instead of tossed in landfill sites, said PAP. The initiative, which was officially launched with an exhibition in Woodlands Drive 50 on Sunday (July 17), will help town councils to save some $275,000 in cost of amenities, said the PAP. Project vice-chairman Hany Soh (Marsiling-Yew Tee GRC) said: ""With this project, we target to relieve Semakau of about 14,400kg of waste, doing our part to prolong its lifespan."" Pulau Semakau is Singapore's only landfill and is expected to be fully filled by 2035. Ms Soh added that MRT trains are a central pillar of the Singapore identity and said that residents will feel a sense of familiarity when they see the repurposed materials. These upcycling ideas were adapted from survey and public consultation feedback by residents, who were asked for suggestions on how old parts from trains could be reused. Ms Soh told The Straits Times that more forms of upcycled amenities may be rolled out in the future. She said: ""We will look at how viable and suitable these suggestions are and how they can be used, depending on each town council."" She added: ""For Marsiling-Yew Tee, we've targeted most of the studio apartments, where there are a lot of seniors. While waiting for lifts or vehicles, those with mobility issues can use the benches installed."" The launch event, held at a multipurpose pavilion in Woodlands, was attended by more than 50 residents, volunteers, media and other guests. The upcycled seats were earlier rolled out at lift lobbies and the void deck area at the housing block where Madam Annie Kwa, 75, lives. The retiree said that the new installations are helpful to the seniors, many of whom live in the studio apartments in the estate. Said Madam Kwa: ""A lot of elderly (people) walk around here and they need to rest. When they are waiting for the lift, they can rest there too."" She added that although the train seats are not new, they are sturdy and easy to wipe down. ""Sometimes the wooden benches have a bad smell when they are old,"" she said, adding that she hopes to see more repurposed benches in the neighbourhood. Another resident, former civil servant Leong Kum Tong, 75, said the handrails will be helpful for the many elderly residents, especially when they walk up ramps. Mr Leong said he was pleased to see old materials reused, and added: ""If we use recycled things, we won't have so much wastage... The parts are old but they still look new."" The project adds to the green initiatives under the Action for Green Towns (AGT) campaign, which involves MPs from each PAP town council working closely with residents on environmental goals. Last December, the campaign kicked off an initiative that rewarded those who recycle paper at one of 77 recycling machines with 6 cents per kilogramme. Giving an update on the project, AGT chairman Wan Rizal (Jalan Besar GRC) said on Sunday that residents saved more than 5,000 trees with the paper they recycled in the first half of the year."
https://www.straitstimes.com/singapore/environment/thundery-showers-expected-in-second-half-of-july-says-met-service,"Thundery showers expected in second half of July, says Met Service","SINGAPORE - Take your brollies with you when heading out in the next two weeks because more thundery showers are expected, says the weatherman. However, fair and warm conditions are expected on the first few days of the second half of July, due to stable atmospheric conditions brought about by the presence of dry air over Singapore and the surrounding region, the Meteorological Service (MSS) said in a statement on Friday (July 15). Stable atmospheric conditions prevent the formation of rain clouds.  But for the rest of the month,  the monsoon rain band is forecast to lie close to the equator, MSS added. This is expected to bring more rainfall over the equatorial South-east Asia region, where Singapore is located.  Short-duration showers accompanied occasionally by thunder are expected over some parts of the island in the late morning and afternoon. On some days, the showers could be heavy, due to the convergence of winds over Singapore and the vicinity, the MSS statement added. “Island-wide thundery showers with occasional gusty winds due to Sumatra squalls can be expected in the predawn hours and morning on some days,” MSS said.  On most days, the daily temperatures are forecast to range between 24 deg C and 33 deg C. The wet weather may bring lower daily temperatures of between 23 deg C and 32 deg C on a few days. Associate Professor Koh Tieh Yong, a weather and climate scientist from the Singapore University of Social Sciences (SUSS), said the rainy weather is typical of the south-west monsoon season which Singapore is experiencing now. “MSS’ prediction of 23 deg C on certain days is not extreme. While it is cooler than the average value of 25.4 deg C in July, we also expect roughly half of July nights to be so,” he said. Night-time minimum temperatures are expected to hover at about 28 deg C, particularly over the eastern and southern coastal areas. The influence of two climate phenomena could also bring more rainfall to Singapore in the coming months, The Straits Times reported in June.  La Nina, as well as the Indian Ocean Dipole, which is now in its negative phase, could cause wetter than average rainfall for Singapore for the June to August period. "
https://www.straitstimes.com/singapore/environment/sustainable-shopping-raffles-city-recycling,Sustainable shopping: How this mall wants to help save the planet with you,"In recent years, terms like “fast fashion” and “overconsumption” have seeped into modern society’s consciousness, giving shopping a bad rap. Raffles City is changing that, one eco step at a time.  Through the Project Green campaign–a series of sustainability initiatives involving retail, hospitality and corporate stakeholders–Raffles City Singapore is revolutionising its retail experience for the better.  “By providing our retailers, office tenants and hotels a suitable platform via Project Green to expand on their green offerings, Raffles City aspires to make a bigger impact to inculcate sustainable living in the daily lives of our shoppers and stakeholders, and to adopt an eco-conscious attitude to make a positive impact on our planet together,” says general manager of Raffles City Singapore, Steve Ng. From July 8 to Sept 25, there will be  a slew of activities lined up for shoppers at the mall. Discover your inner eco-warrior when you take part in workshops that teach you how to incorporate recycling into your everyday life, through ordinary activities like dining and shopping. Here are three easy ways to get involved. Held at Raffles City Level 3 Atrium, the Project Green showcase features brands within the mall and their sustainability efforts.  Leading by example, Raffles City has created part of the display using upcycled materials from the mall’s past Christmas decorations. It includes a prominent tree centrepiece with two bicycles that shoppers can pedal to power up the lights.  In addition, an Adopt-A-Tree initiative by local cafe, The Providore, gives shoppers another avenue to practise sustainability efforts. Participants can help repopulate forests in Sumatra and Borneo, while helping to lower carbon emissions at the same time. The main Project Green showcase is divided into four zones that feature different tenants from F&B, beauty, and fashion, along with an exhibition area that displays the initiatives by Swissotel the Stamford and Fairmont Singapore, as well as the CapitaLand Master Plan 2030.  Meanwhile, you can also help weave the Pledge for Sustainability art mural at the exhibition area using recycled cotton and fabric, and possibly end up contributing to bid for the largest textile yarn installation in the Singapore Book of Records!  At the F&B and beauty zones are Nespresso and L’Occitane, which will hold masterclasses and upcycling workshops. Learn how Nespresso recycles their used capsules, turning them into new aluminium objects, while L’Occitane unveils its Recycling Program – the first in Singapore to accept empty packing from any beauty brand. And while you’re at it, why not pop by their first and only eco store in Singapore on Level 1?  The fashion zone, on the other hand, will include brands like the socially conscious Little Match Girl and Lush cosmetics, as well as Furla, with its Bloom bag made from a special paper-like fabric and recycled acrylic chain strap. Social enterprise Terra SG, known for its engaging eco-education programmes, will be running weekend public workshops. Featured mall tenants will also take turns to run workshops that help educate shoppers on other ways to go green.  Going green is not just in fashion these days – it’s essential to help reduce our carbon footprint and preserve the Earth for the generations to come.  Unsure how to start? Head to the Green Corner at Lobby A on Basement 2 for inspiration.  A permanent set-up, the space has been reimagined and decked out with preserved moss, recycled wood and steel frames, with low-energy lighting and interactive elements.  To be refreshed every quarter, the Green Corner is designed to educate the public about sustainability and how to adopt good recycling habits. Featuring interactive educational displays, vending machines which take in recyclable items, as well as recycling and e-waste bins, the Green Corner also has a Bag Sharing Station for shoppers to, well, share the love by depositing their unused paper bags for other shoppers to take and use. With beautifully designed reusable bags becoming commonplace in Singapore, make ‘Bagless Fridays’ your new shopping habit as you wind down for the weekend. A new initiative by Raffles City, ‘Bagless Fridays’ will take place throughout the Project Green campaign. Shoppers are encouraged to BYOR (Bring Your Own Reusables), with participating tenants not offering shopping bags in order to reduce plastic bag use and wastage. As a bonus, shoppers who use their own recyclable bags at participating stores at Raffles City can earn double STAR$ on the CapitaStar app.   For a minimum spend of $450, shoppers will receive a Raffles City x Tiong Bahru Bakery limited edition reusable Sttoke cup specially designed in celebration of the bakery’s 10th anniversary.  With Project Green, Raffles City is leading the way in encouraging a sustainable lifestyle, while showing us how simple it can be. So the next time you head out to the mall, how about taking that reusable bag with you? 
Learn more about Raffles City’s Project Green initiative here."
https://www.straitstimes.com/singapore/environment/spores-third-national-climate-change-study-to-be-completed-in-sept-2023,S'pore's third national climate change study to be completed in Sept 2023,"SINGAPORE - Singapore's third national climate change study, which will provide localised and high-resolution climate projections till 2100, will be completed in September next year. The study will provide South-east Asia's most advanced climate projections, zeroing in on every square of land or sea spanning 8km. It will help countries plan ways to guard against the dangerous effects of climate change in the most accurate way possible. The model will divide Singapore and the rest of the region's land and sea into grid cells of 8km by 8km , and each cell's changes in temperature, humidity, wind speed, rainfall amount and sea level rise will be projected till 2100. This is finer than usual global models, where the side of each grid cell spans between 70km and 250km, which means Singapore appears as just one grid point, or not at all, because the island city-state is only about 45km across at its widest. The Centre for Climate Research Singapore (CCRS) has been working with the National Supercomputing Centre to scale down global climate models to produce the 8km resolution forecasts. Localised projections are important as different regions experience climate change differently. To date, about 60 per cent to 70 per cent of data has been produced for the study, and researchers will start to analyse the data next year, said Dr Dale Barker, director of CCRS, at the third Sea Level Conference of the World Climate Research Programme on Tuesday (July 12). Minister for Sustainability and the Environment Grace Fu, who gave the opening address at the conference at Sands Expo and Convention Centre, noted that climate scientists have found this region's climate, especially rainfall patterns, particularly challenging to model. Rainfall in South-east Asia is affected by many factors. But many climate scientists call this region the engine room of the global climate system, said Ms Fu. ""The atmosphere, water bodies and land masses here are in constant conversation with each other, exchanging huge quantities of heat and moisture, and fuelling global atmospheric and ocean circulation,"" she added. Localised and high-resolution models of temperature, rainfall and wind changes here will allow scientists to better assess the impacts of climate change on local crop and aquaculture yields, for example. This will help the country choose sea spaces that are more suitable for aquaculture, said Ms Fu. Dr Barker added that the data from the regional climate projections can be used in near-future projects such as the newly launched Climate Impact Science Research Programme, which will scrutinise the long-term effects of the warming planet in areas, including biodiversity and energy. Singapore will share its downscaled regional climate projections with the region so countries can use them in their adaptation planning. The Republic's climate science research will not end with its third national climate change study, also called V3. After September next year, CCRS will work on a V3+, which will focus on modelling urban heat scenarios and storm surge parameters. The fourth national study, or V4, will be completed around 2027, said Dr Barker."
https://www.straitstimes.com/singapore/environment/laos-has-safeguards-to-reduce-social-environmental-impacts-of-dams-ema,Laos has safeguards to cut environmental and social impact of exporting power to S'pore: EMA,"SINGAPORE - Laos has safeguards that will help to reduce the environmental and social impacts of hydropower projects in the country, from where Singapore is importing renewable energy. Mr Ralph Foong, deputy chief executive of the energy planning and development division at the Energy Market Authority (EMA), said: ""One of the safeguards includes requiring all hydropower projects to undertake a comprehensive environment and social impact assessment, and to have impact management and monitoring plans before construction."""
https://www.straitstimes.com/singapore/environment/new-65m-effort-to-make-nanoparticle-manufacturing-in-spore-cheaper-more-efficient,"New $6.5m effort to make nanoparticle manufacturing in S'pore cheaper, more efficient","SINGAPORE - A new Singapore-based research project that aims to speed up the manufacture of nanoparticles - which are used in everything from Covid-19 vaccines to sunscreen and spacecraft - was launched on Monday (July 11). The $6.5 million effort - called the Accelerated, Manufacturing Platform for Engineered Nanomaterials (Ample) - will develop a manufacturing platform that can be rapidly scaled up to produce up to 100kg of nanoparticles a day. Ample is funded by the National Research Foundation's Central Gap Fund. Current nanomaterial manufacturing techniques are time-intensive, inaccurate or bulky, said Dr Nicholas Jose, one of the project leads for Ample. However, this new platform could help to reduce the time needed for such materials to come to market, he added. This experimental platform, conducted by the Cambridge Centre for Advanced Research and Education in Singapore (Cares) and NTUitive, the innovation and enterprise company of Nanyang Technological University (NTU), is expected to be commercialised in Singapore around 2024, said the two institutions in a joint statement on Monday. While Ample will initially focus on manufacturing antimicrobial zinc oxide particles, which are used in sunscreen and self-cleaning coatings, the technology can also be used to manufacture other products, they said. These include, for example, biological capsules that are used to encase mRNA in Covid-19 vaccines, and advanced coatings for spacecraft. Dr Jose said: ""We can see nanomaterial applications all around us - in paints, computers, cars, medicine and textiles, to name a few."" He added that the microscopic particles, which can be up to 10,000 times smaller than the width of a human hair, can dramatically enhance the performance of current products and even enable the development of new products. NTUitive chief executive David Toh said: ""The success of this multidisciplinary project... will put Singapore in the lead position to produce novel nanomaterials, a field where the nation is already at the forefront."" Dr Jose, a Cares research fellow, said that nanomaterials are usually made slowly in large containers with high temperatures, pressures and toxic chemicals, or are produced quickly yet imprecisely through techniques like the grinding or burning of larger molecules. This process of slow experimental scaling-up leads to a lead-up time of between 10 years and 20 years for a nanomaterial to come into the market. As a result, the long timeline to commercialisation makes investors and industries reluctant to invest, creating a ""chicken or egg"" dilemma. He added: ""Some of the first materials like graphene, which was discovered in 2003, still have not reached economically viable tonne-scale production."" Graphene, which can conduct electricity, is being studied for use in gene therapy and to create more durable hydrogen fuel cells for cars, among other things. However, Dr Jose said that Ample's technique, which uses a combination of machine learning and new reactor technology for efficient energy generation, will allow for the fast and accurate manufacturing of nano materials at a much lower cost. He said: ""Singapore and the world will undoubtedly face new and daunting challenges, whether pandemics or rising temperatures, which new materials are necessary to solve."" By providing an economical pathway to rapidly produce and commercialise these innovations in nanotechnology, Dr Jose hopes that such research will be brought to the masses at a faster rate. Professor Lam Yeng Ming, chair of NTU's School of Materials Science and Engineering, who is not involved in Ample, said that the central bottleneck for the application of nanoparticles lies in how much of these can be manufactured. Prof Lam, who created a face mask filter with copper oxide nanoparticles that can destroy 99.9 percent of bacteria and viruses in face masks, said: ""To be able to produce large amounts of nanoparticles in a short time will ensure the adoption of the use of these nanoparticles."" She added that, ultimately, the ability to shorten the manufacturing process of these nanoparticles while keeping manufacturing precision high will shorten the time for this material to be produced in reasonable scale and used practically."
